created_utc,score,domain,id,title,author,ups,downs,num_comments,permalink,selftext,link_flair_text,over_18,thumbnail,subreddit_id,edited,link_flair_css_class,author_flair_css_class,is_self,name,url,distinguished
1418369033.0,32,self.AskMen,2p25yt,FAQ FRIDAY POST: How can I nicely and politely turn down a guy?,AskMenMods,32,0,37,http://www.reddit.com/r/AskMen/comments/2p25yt/faq_friday_post_how_can_i_nicely_and_politely/,"Please try to include the following in your response:

* How would you like to be told a woman is not interested in you?

* How would you NOT like to be a told or shown a woman is not interested in you?

**Please keep in mind this post is going into our [FAQ](http://www.reddit.com/r/AskMen/wiki/index). Off topic and unhelpful responses will be removed at our discretion.**",,False,,t5_2s30g,False,,,True,t3_2p25yt,http://www.reddit.com/r/AskMen/comments/2p25yt/faq_friday_post_how_can_i_nicely_and_politely/,moderator
1418381567.0,399,self.AskMen,2p2i4v,"Askmen can seem like a vast battlefield of relationship horror stories, because happy people rarely speak up. C'mon guys, lets hear some success stories! What makes you happy with your SO right now?",BigAngryDinosaur,399,0,220,http://www.reddit.com/r/AskMen/comments/2p2i4v/askmen_can_seem_like_a_vast_battlefield_of/,"I'd love to see some of the guys here who are in good relationships speak up about what they've learned, what they had to do to make it work, and what they get out of it now.

Ages/time together are optional but may help provide context.

Edit: Wow, awesome response! I am reading every single story here. Everyone should. Just like how positive reinforcement in a relationship is a powerful tool, that is reminding each other what you enjoy and appreciate about each other, you should also nurture your own feelings and exposing yourself to good stories and a positive image of love and relationships. Thank you all so far.",,False,,t5_2s30g,1418394865.0,,male,True,t3_2p2i4v,http://www.reddit.com/r/AskMen/comments/2p2i4v/askmen_can_seem_like_a_vast_battlefield_of/,
1418406750.0,35,self.AskMen,2p3hpn,"Men, how often do you kiss your partner in public?",Red_AtNight,35,0,48,http://www.reddit.com/r/AskMen/comments/2p3hpn/men_how_often_do_you_kiss_your_partner_in_public/,"So, we were at my fiancee's co-worker's house for dinner last night.  Probably 20 people were there?  I was chatting with a few of her colleagues and their spouses, and she was over speaking with two of her co-workers.  Since they were shop talking, I drifted away.  

Anyways I got up at one point to go grab a drink, and as I walked past her, I kissed her on top of the head.  Like a normal thing - just to say hi.

She told me as we were driving home that both of her coworkers said how long it had been since their husbands had been so physical/demonstrative with their affection - which is now making me think, am I a weirdo?  Are we just in a newlywed (pardon the expression) phase?  

Anyways I was curious about what other guys do in situations like that.  ",,False,,t5_2s30g,False,,male,True,t3_2p3hpn,http://www.reddit.com/r/AskMen/comments/2p3hpn/men_how_often_do_you_kiss_your_partner_in_public/,
1418404476.0,34,self.AskMen,2p3di3,"Men in your 20s, do any of you not follow a single show? How does it go for you in social settings?",bonesrus,34,0,77,http://www.reddit.com/r/AskMen/comments/2p3di3/men_in_your_20s_do_any_of_you_not_follow_a_single/,"These days it seems like the topic of discussing tv shows is pretty much unavoidable. I feel a bit left out when this happens in social situations, but not interested enough to be bothered with actually watching something. I usually just keep quiet when/if it comes up, and don't volunteer the information unless pressed.",,False,,t5_2s30g,False,,,True,t3_2p3di3,http://www.reddit.com/r/AskMen/comments/2p3di3/men_in_your_20s_do_any_of_you_not_follow_a_single/,
1418407852.0,21,self.AskMen,2p3jsp,Anyone started dating a college girl after graduating?,_ButtSoup,21,0,25,http://www.reddit.com/r/AskMen/comments/2p3jsp/anyone_started_dating_a_college_girl_after/,"Was it weird? Just elaborate a bit on the experience, how well it worked out, rank it out of ten, would you do it a second time given the chance? ",,False,,t5_2s30g,False,,,True,t3_2p3jsp,http://www.reddit.com/r/AskMen/comments/2p3jsp/anyone_started_dating_a_college_girl_after/,
1418393804.0,35,self.AskMen,2p2vo1,Who has the best pet?,AdvocateForGod,35,0,131,http://www.reddit.com/r/AskMen/comments/2p2vo1/who_has_the_best_pet/,"Why?

Also dogs are the best.",,False,,t5_2s30g,False,,male,True,t3_2p2vo1,http://www.reddit.com/r/AskMen/comments/2p2vo1/who_has_the_best_pet/,
1418412266.0,12,self.AskMen,2p3s1q,Girlfriend and I are living together starting next month. Could use some pointers on how to handle certain aspects of the situation.,BernoulliRandom,12,0,29,http://www.reddit.com/r/AskMen/comments/2p3s1q/girlfriend_and_i_are_living_together_starting/,"We've been dating for a year and have been very good friends for 3.  Both moving across the country for jobs. 

What should I be considering to prevent a bad break up? Its not that I think were going to - I hope we don't - but u feel its something that needs to be considered. This is what we've done so far.

* Have a conversation about the ""what ifs""
* Rented a 2bdrm apartment that each of us could afford on our own.
* Both our names are on everything. The lease, utilities, etc.
* Briefly spoken about finances",,False,,t5_2s30g,False,,,True,t3_2p3s1q,http://www.reddit.com/r/AskMen/comments/2p3s1q/girlfriend_and_i_are_living_together_starting/,
1418420014.0,7,self.AskMen,2p46c4,"Is the whole ""being beta"" thing overblown or true?",gradschool321,7,0,28,http://www.reddit.com/r/AskMen/comments/2p46c4/is_the_whole_being_beta_thing_overblown_or_true/,"A lot of people both in real life and online constantly harp on the dangers of ""being beta"". Whether that be texting a girl too much, sending her ""good morning"" texts, not being too invested, ignoring her occasionally. whatever. 

So the point is whenever I'm with a girl (after having a bad breakup some time back) I am constantly terrified of scaring them off by ""being beta"" and them losing attraction. This stuff is all over the internet.

How true/false is it and how can I get over with it? ",,False,,t5_2s30g,False,,,True,t3_2p46c4,http://www.reddit.com/r/AskMen/comments/2p46c4/is_the_whole_being_beta_thing_overblown_or_true/,
1418415483.0,8,self.AskMen,2p3xyh,Have any of you guys ever studied abroad? I'd love some insight.,MilesTeller,8,0,22,http://www.reddit.com/r/AskMen/comments/2p3xyh/have_any_of_you_guys_ever_studied_abroad_id_love/,"I'm looking into studying abroad through my university, more than likely for a full fall semester in either Iceland or somewhere in the UK. I'd love to hear advice or your thoughts on it all.",,False,,t5_2s30g,False,,,True,t3_2p3xyh,http://www.reddit.com/r/AskMen/comments/2p3xyh/have_any_of_you_guys_ever_studied_abroad_id_love/,
1418410962.0,9,self.AskMen,2p3pk9,What are you getting your SO's parents?,UbiquitouSparky,9,0,16,http://www.reddit.com/r/AskMen/comments/2p3pk9/what_are_you_getting_your_sos_parents/,"This Christmas I'm spending the 25th at my (26M) girlfriends (21F) grandparents' place. I have no idea how old they are, but they're grandparents. I need some kind of gift for both of or each of them, as well as her parents.

Some info:

All of them like tea. 

Her grandfather was in the navy and has a love for Aviation. I plan to take him flying with me (recently acquired ppl) but that's not until the spring. 

Her grandmother I know nothing about.

Her dad is in the police force, is nearing retirement, and doesn't like his job.

Her mom is a preschool teacher and loves her work.

I included a bit of info in case any of you have an awesome idea for something related. I have no issues with getting them semi generic gifts, I just have no ideas. Please help! Sorry if the formatting is terrible I'm on mobile.

E: thanks for the ideas so far everyone. With everyone saying they aren't buying anything, I wish I was in the same boat. They all bought something for me last year and my gf said they're buying something for me this year. With that I don't think I could get them nothing and not feel guilty.

Alcohol was suggested - her grandfather is a recovering alcoholic and I don't think her parents drink. Her grandparents also own a cabin on a nearby Island so I'm trying to think of something with nature that might be useful.

Keep the ideas flowing! ",,False,,t5_2s30g,1418422709.0,,,True,t3_2p3pk9,http://www.reddit.com/r/AskMen/comments/2p3pk9/what_are_you_getting_your_sos_parents/,
1418415419.0,7,self.AskMen,2p3xtz,What's something that you like/used to like that most people seem to guilt you for?,rakishscarf,7,0,52,http://www.reddit.com/r/AskMen/comments/2p3xtz/whats_something_that_you_likeused_to_like_that/,,,False,,t5_2s30g,False,,male,True,t3_2p3xtz,http://www.reddit.com/r/AskMen/comments/2p3xtz/whats_something_that_you_likeused_to_like_that/,
1418410368.0,9,self.AskMen,2p3ofz,Special sex? What's the best sex you've ever had and what made it that way?,chloboe,9,0,13,http://www.reddit.com/r/AskMen/comments/2p3ofz/special_sex_whats_the_best_sex_youve_ever_had_and/,"My boyfriend requested special sex as a graduation present for getting his B.Sc... I'm on a train that will arrive in his town in 8-ish hours and I'm completely stuck.

What's the best sex you've ever had? What made it so great? Anything you wish a girl would do in bed?",,False,,t5_2s30g,False,,,True,t3_2p3ofz,http://www.reddit.com/r/AskMen/comments/2p3ofz/special_sex_whats_the_best_sex_youve_ever_had_and/,
1418416513.0,6,self.AskMen,2p3ztt,"If you could only afford to eat one thing per day, what would your first choices be?",selfsmartyourself,6,0,20,http://www.reddit.com/r/AskMen/comments/2p3ztt/if_you_could_only_afford_to_eat_one_thing_per_day/,"Why would you choose these food items? 

I think that this needs to be split into two categories: 

Food that needs to be prepared 
Food that can be eaten right when you buy it. ",,False,,t5_2s30g,False,,,True,t3_2p3ztt,http://www.reddit.com/r/AskMen/comments/2p3ztt/if_you_could_only_afford_to_eat_one_thing_per_day/,
1418401778.0,12,self.AskMen,2p38nq,Going to a Christmas dinner/party next week - I know no-one there. How to socialise?,GfxJG,12,0,28,http://www.reddit.com/r/AskMen/comments/2p38nq/going_to_a_christmas_dinnerparty_next_week_i_know/,"Background info - I'm 19, male, studying at University, average attractiveness, single.

Basically, earlier this month, I started doing some volunteer work at a cafe/music venue, run by volunteering University students in my city. So far I've only had 1 shift, so I've met like, 2 people.

Anyways, the venue is hosting a free Christmas dinner/party/whatever for all the volunteers, which I plan on attending, since half my reason for signing up was to socialize (moved in the summer, I know basically no-one except for people in my study group). But I realise, I have no fucking clue how to. Once I get talking to someone, basically even if it's just a 3 sentence exchange, I have no problem talking to people. I just have trouble breaking the initial ice.

The main aim of attending this is to socialise, but I am single, so obviously, I wouldn't mind meeting some girls too. Not one-night-stands though, they aren't my type of thing.

So basically, any tips to start talking to a random group of people whom I've never met? There's no saying if the two people I have met will be there.

Thanks in advance.

PS: Should be mentioned, while I don't mind drinking alcohol, I don't like getting shitfaced. Tipsy/borderline drunk, I have no issues with though.",,False,,t5_2s30g,1418403015.0,,,True,t3_2p38nq,http://www.reddit.com/r/AskMen/comments/2p38nq/going_to_a_christmas_dinnerparty_next_week_i_know/,
1418367850.0,56,self.AskMen,2p24ix,Do you ever not find your girlfriend attractive?,5pecial,56,0,86,http://www.reddit.com/r/AskMen/comments/2p24ix/do_you_ever_not_find_your_girlfriend_attractive/,I don't mean in the mornings before she puts on makeup. I mean her everyday normal appearance.,,False,,t5_2s30g,False,,,True,t3_2p24ix,http://www.reddit.com/r/AskMen/comments/2p24ix/do_you_ever_not_find_your_girlfriend_attractive/,
1418386294.0,21,self.AskMen,2p2mrl,"Gentlemen, may I have your (brutally honest) perspective on how I handled this situation and how I should proceed?",alewu17,21,0,41,http://www.reddit.com/r/AskMen/comments/2p2mrl/gentlemen_may_i_have_your_brutally_honest/,"I met a guy in August. We had great chemistry, and things were going well. He mentioned before I came over the first time (late September) that he had recently ended a relationship with a live-in girlfriend, and her decorations would still be all over the apartment. I appreciated the honesty and told him so, and there was nothing except his furniture there the next time (two weeks later), which made me feel better.

However, when I was sleeping over one night (about a month after my first visit), I found a bunch of long, dark hairs on the floor, and I do not have long dark hair. I asked him about it, and he wrote it off. I was really uneasy, and I realize that this probably makes me the crazy girl, but I started looking around. Found out from his ex's Instagram and Twitter accounts that she had definitely still been there on multiple occasions. He came over the day I found out, and I explained to him what I had found, why I went looking for it, and I asked him to explain what was going on. She was apparently uninterested in moving out altogether, and would get really emotional whenever he tried to force the issue. He did seem remorseful, and I knew it was his first time ever living with anyone, let alone dealing with that fallout. So, I told him I'd be around while he figured it out.

Five weeks later, she's still not out. He looks defeated and tired but unwilling to remove her--which makes me think that he was still in love with her. So, I told him it was me or her, and that I wasn't going to sleep with him until I knew she was out (we hadn't had sex for over a month at that point, and I suspected that there was definitely something going on with them). 

Suffice it to say, I am not seeing him anymore. I do, however, still receive emails from him saying that he wants to see me and ""love me like there's no tomorrow."" His girlfriend is decorating for Christmas and nesting like there's no tomorrow (I should not know this, but I do), and I don't think she has a clue what happened. 

I did exactly what I needed to do for me, which was to end any involvement with him. But, I have a few questions. (I recently relocated to another country and therefore haven't had a lot of people to talk to about this.)

1) What do you guys think of this guy and his actions?

2) Did I do the right thing by sticking around as long as I did?  

3) Should I have given him an ultimatum? How do guys generally respond to ultimatums? 

4) I wanted to let this slide and let them move on with their lives, but the emails are really bothering me. Should I out him to her?

I know responses will be pretty subjective, which is exactly what I'm looking for. Thanks for reading! ",,False,,t5_2s30g,False,,,True,t3_2p2mrl,http://www.reddit.com/r/AskMen/comments/2p2mrl/gentlemen_may_i_have_your_brutally_honest/,
1418361394.0,68,self.AskMen,2p1vtk,DAE feel like there's weird pressure to NOT get married sometimes?,Steel_Pump_Gorilla,68,0,227,http://www.reddit.com/r/AskMen/comments/2p1vtk/dae_feel_like_theres_weird_pressure_to_not_get/,"I keep hearing about how much ass I'm going to get and how it's so great to be single into my late 30s. Now I'm not saying that it's not a great life and that it wouldn't be fun, I'm just saying that I'm in love with someone and know what it's like to have sex with various types of women. I don't feel the need to bang a bunch of girls or remain ""detached"" for whatever other purposes, so I don't see the point in being single if I'm with someone I love and who loves me back.

I don't buy the whole ""women are terrible nowadays"" line because I just don't really attract ""bad"" women. No crazy ex girlfriend stories or what have you. I also think that women have been how they've always been, to be honest. One of those, ""the more things change, the more they stay the same"" kind of deals.

Again, if I weren't with this girl I'd definitely be single. I've got a great job and would be a VERY eligible bachelor if I were single, I just don't want to be.",,False,,t5_2s30g,False,,male,True,t3_2p1vtk,http://www.reddit.com/r/AskMen/comments/2p1vtk/dae_feel_like_theres_weird_pressure_to_not_get/,
1418411125.0,5,self.AskMen,2p3puz,Help me brush up my massage?,jaardreign,5,0,8,http://www.reddit.com/r/AskMen/comments/2p3puz/help_me_brush_up_my_massage/,"Hey dudes! I have a date tonight (THIRD date, holy crap), and this girl wants me to give her a massage. Last massage I gave was over a year ago, though that girl gave it rave reviews. I'm feeling a bit rusty at the moment, though. Anyone have any good tips or can point me in the right direction?",,False,,t5_2s30g,False,,male,True,t3_2p3puz,http://www.reddit.com/r/AskMen/comments/2p3puz/help_me_brush_up_my_massage/,
1418393420.0,10,self.AskMen,2p2v51,Do any of you seem to only attract girls that have boyfriends?,Rockaustin,10,0,32,http://www.reddit.com/r/AskMen/comments/2p2v51/do_any_of_you_seem_to_only_attract_girls_that/,"Or am I just that unlucky? It's been a long time since I've attracted a girl who was single. I've made the mistake of trying to pursue once and that ended up being really terrible. 
The girl that I love to death is polyamorous and that's a deal breaker obviously. She's my best friend now but it still sucks.

Anyone else in the same boat?
",,False,,t5_2s30g,False,,,True,t3_2p2v51,http://www.reddit.com/r/AskMen/comments/2p2v51/do_any_of_you_seem_to_only_attract_girls_that/,
1418392465.0,12,self.AskMen,2p2tsl,Teach me how to beer?,melmanthegiraffe,12,0,47,http://www.reddit.com/r/AskMen/comments/2p2tsl/teach_me_how_to_beer/,"My Dad has had a best friend for 20+ years  that is like an uncle/ godfather to me. He has been SUPER supportive through this last year, missing a day of work at something like $35/hour to come to my high school graduation, taking me out for coffee, and coming by my work to buy something small and leaving me a ridiculous tip.  I was to give back to him for Christmas and my Dad has been telling me that he's been really into beer lately. Thing is, he likes ""all beer"" so I should just ""get him whatever"". I don't know anything about beer, so what would you recommend? 

Tl;dr - I want to get my uncle beer for Christmas but I don't know what I'm doing",,False,,t5_2s30g,False,,female,True,t3_2p2tsl,http://www.reddit.com/r/AskMen/comments/2p2tsl/teach_me_how_to_beer/,
1418368412.0,40,self.AskMen,2p2567,Music you've gotten laid to?,CoyJoy,40,0,140,http://www.reddit.com/r/AskMen/comments/2p2567/music_youve_gotten_laid_to/,"For me: It was coming from my phone, something slow-ish, I don't remember. Because Spotify only does shuffle on phones and doesn't let you loop (for some reason), we just let it do it's thing. [I forgot I had this.](https://www.youtube.com/watch?v=qdsTUfDTEhQ) Whoops.

Him: Uh. OP?

Cue, me giggling pretty hard.

Him: Wanna change it?

Me: Skip it, sure.

He couldn't reach, position didn't let me move. We just left it on and did our thing.

I lost it at Iggy's part. ",,False,,t5_2s30g,False,,female,True,t3_2p2567,http://www.reddit.com/r/AskMen/comments/2p2567/music_youve_gotten_laid_to/,
1418419072.0,2,self.AskMen,2p44lf,Do guys prefer it when girls wear more girly clothes?,rightrough,2,0,44,http://www.reddit.com/r/AskMen/comments/2p44lf/do_guys_prefer_it_when_girls_wear_more_girly/,I think of myself as pretty stylish but I don't wear very feminine clothes. Should I start wearing more feminine clothes to impress the guy I like? I know that he likes me and I'm the kind of person who dresses for herself but I'm just curious does it really matter for guys?,,False,,t5_2s30g,False,,,True,t3_2p44lf,http://www.reddit.com/r/AskMen/comments/2p44lf/do_guys_prefer_it_when_girls_wear_more_girly/,
1418417744.0,3,self.AskMen,2p423d,What song best describes your up-coming weekend plans?,UnstableFlux,3,0,24,http://www.reddit.com/r/AskMen/comments/2p423d/what_song_best_describes_your_upcoming_weekend/,"Please link it!

Mine would probably be [Hello Weekend by Biscuits and Gravy](https://www.youtube.com/watch?v=NAfVhBoXyfw)",,False,,t5_2s30g,False,,male,True,t3_2p423d,http://www.reddit.com/r/AskMen/comments/2p423d/what_song_best_describes_your_upcoming_weekend/,
1418403403.0,5,self.AskMen,2p3bkx,"In your manly opinion, how much do side pockets, fly/no fly, drawstring vs. elastic waist, chest pockets and side split hems matter on PJs? Which features are essential, and which are unnecessary?",2OQuestions,5,0,34,http://www.reddit.com/r/AskMen/comments/2p3bkx/in_your_manly_opinion_how_much_do_side_pockets/,"Husband likes PJs, is in his early 40s, and we live in an almost-tropical environment. ",,False,,t5_2s30g,False,,,True,t3_2p3bkx,http://www.reddit.com/r/AskMen/comments/2p3bkx/in_your_manly_opinion_how_much_do_side_pockets/,
1418401690.0,5,self.AskMen,2p38ho,Are you familiar with this feeling?,virginattheageof21,5,0,16,http://www.reddit.com/r/AskMen/comments/2p38ho/are_you_familiar_with_this_feeling/,Feeling of being ignored by people who you like? By people who used to tell you that you are a very good friend of him/her? Example: You come up with an idea to hang out with someone. You asked whether she can go out on Friday. She says that she rather has a free friday but she will tell me exactly on Thursday. And as it appears later she says that she goes to a concert. Just an example. Did you came across such situation? How do you deal with it? ,,False,,t5_2s30g,False,,,True,t3_2p38ho,http://www.reddit.com/r/AskMen/comments/2p38ho/are_you_familiar_with_this_feeling/,
1418316852.0,383,self.AskMen,2ozilj,"Men of Reddit: Do you sometimes search for, or watch porn that you're really not into simply out of curiosity or boredom?",after-eight,383,0,254,http://www.reddit.com/r/AskMen/comments/2ozilj/men_of_reddit_do_you_sometimes_search_for_or/,Just curious since it's not something I think girls do (well not ones I know),,False,,t5_2s30g,False,,female,True,t3_2ozilj,http://www.reddit.com/r/AskMen/comments/2ozilj/men_of_reddit_do_you_sometimes_search_for_or/,
1418362174.0,33,self.AskMen,2p1wzw,"What's your favorite ""reality show""",pridejoker,33,0,112,http://www.reddit.com/r/AskMen/comments/2p1wzw/whats_your_favorite_reality_show/,My reality tv guilty pleasure is Hell's Kitchen.,,False,,t5_2s30g,False,,,True,t3_2p1wzw,http://www.reddit.com/r/AskMen/comments/2p1wzw/whats_your_favorite_reality_show/,
1418407530.0,2,self.AskMen,2p3j7t,"If you could write a Christmas song, but wanted something fresh, what would be the topic?",TXSC,2,0,13,http://www.reddit.com/r/AskMen/comments/2p3j7t/if_you_could_write_a_christmas_song_but_wanted/,"If you wanted to write a Christmas song, but didn't want to write about an aspect that has been ""done to death"" what would you focus on?

This is not a gift or about anyone in particular.  Just wondering what topics you guys would find interesting.

x-post from /r/askwomen

tl:dr:  What would your new Christmas song focus on?",,False,,t5_2s30g,1418408559.0,,male,True,t3_2p3j7t,http://www.reddit.com/r/AskMen/comments/2p3j7t/if_you_could_write_a_christmas_song_but_wanted/,
1418413162.0,1,self.AskMen,2p3toc,How long will you talk/date a girl before making it official?,mscheech,1,0,19,http://www.reddit.com/r/AskMen/comments/2p3toc/how_long_will_you_talkdate_a_girl_before_making/,"Enough said. When do you make it more official than simply taking her out to dinner, telling her you like her, sleepovers, etc?",,False,,t5_2s30g,False,,female,True,t3_2p3toc,http://www.reddit.com/r/AskMen/comments/2p3toc/how_long_will_you_talkdate_a_girl_before_making/,
1418398965.0,4,self.AskMen,2p33qo,Garage accessories?,mmhmmsure,4,0,23,http://www.reddit.com/r/AskMen/comments/2p33qo/garage_accessories/,"What are the coolest, handiest, or the most useful items or accessories every guy should have in his garage?",,False,,t5_2s30g,False,,female,True,t3_2p33qo,http://www.reddit.com/r/AskMen/comments/2p33qo/garage_accessories/,
1418423549.0,0,self.AskMen,2p4cq9,Relationship: now or later?,robbob009,0,0,5,http://www.reddit.com/r/AskMen/comments/2p4cq9/relationship_now_or_later/,"Hello Men,

I have a bit of a problem.  I've been hitting it off with a girl I've know for quite a while, and I'd like to ask her out.  However at the end of next week, the semester ends (we're both college students).  She lives across the States, which makes visiting frankly something I can't afford.

To make things even better, I'm going on co-op for the Spring, about a 4.5 hour drive.  And I don't have a car.  I really don't know if I'll be able to visit, and I doubt she could either.  I wouldn't be seeing her regularly again until next August. 

Do I try to start a relationship long distance?  Do I wait until next fall and hope she hasn't found someone else? I've got about 3 weeks of high school dating as my only experience, I really don't know what I'm doing.  If you've got any advice I'd love to hear it.  Thanks!",,False,,t5_2s30g,False,,,True,t3_2p4cq9,http://www.reddit.com/r/AskMen/comments/2p4cq9/relationship_now_or_later/,
