created_utc,score,domain,id,title,author,ups,downs,num_comments,permalink,selftext,link_flair_text,over_18,thumbnail,subreddit_id,edited,link_flair_css_class,author_flair_css_class,is_self,name,url,distinguished
1418423505.0,0,self.AskMen,2p4cmv,"Men with black/brown haired (blue-eyed) girlfriends, how did blond look on them?",patriotperry,0,0,2,http://www.reddit.com/r/AskMen/comments/2p4cmv/men_with_blackbrown_haired_blueeyed_girlfriends/,"I love my girlfriend deeply, but she is wondering how blond will look on her. I told her that I don't know for sure.

Which sparked my interest. How did your non-blond girlfriends look like when they went blond from black/brown? I put in blue-eyes since my girlfriend has them, and I feel that eyecolor also has influence whether it will suit her.

In your personal opinion, recommend or not? And state whether it was whiteblond, goldblond, darkblond (picture of a haircolor product as reference).",,False,,t5_2s30g,False,,,True,t3_2p4cmv,http://www.reddit.com/r/AskMen/comments/2p4cmv/men_with_blackbrown_haired_blueeyed_girlfriends/,
1418408556.0,1,self.AskMen,2p3l4k,"Does any one else hate when your SO replies ""Sure""?",jbarr676,1,0,32,http://www.reddit.com/r/AskMen/comments/2p3l4k/does_any_one_else_hate_when_your_so_replies_sure/,,,False,,t5_2s30g,False,,,True,t3_2p3l4k,http://www.reddit.com/r/AskMen/comments/2p3l4k/does_any_one_else_hate_when_your_so_replies_sure/,
1418421595.0,1,self.AskMen,2p497u,A question about pursuing guys,goalygoalychimp,1,0,12,http://www.reddit.com/r/AskMen/comments/2p497u/a_question_about_pursuing_guys/,"(tried to post this under a throwaway and got deleted.  oh well.  here it is again)

Hi guys,

As a generally physically-unattractive girl with some major body image issues (very overweight and masculine in appearance - think Rosie O'Donnell), I've gotten to age 26 without ever having been in a relationship with a guy. Most of my friends are pretty attractive girls who always seem to get ""approached."" That doesn't ever happen to me and I've accepted that.  It's the way the world works.  That said, the few times (4-5 times total) I've pursued a guy or expressed interest, I've been turned down (""I only see you as a friend... you're like a sister to me, etc...)  
My question is:
as a physically unattractive female,
how do I go about expressing interest in a guy without:

- seeming desperate? (which I imagine is a major turn-off)

- being automatically ""friend-zoned"" becuase of the way I look?
",,False,,t5_2s30g,False,,,True,t3_2p497u,http://www.reddit.com/r/AskMen/comments/2p497u/a_question_about_pursuing_guys/,
1418420583.0,0,self.AskMen,2p47dp,How do I make moves at a public party? (serious question),dupey19th,0,0,3,http://www.reddit.com/r/AskMen/comments/2p47dp/how_do_i_make_moves_at_a_public_party_serious/,"Sorry this might be long. I need some help. I really don't know what to do:
I am part of a popular NYC Theater group. There's about 1500 members in this theater. The theater throws a lot of parties, the holiday party is this week for example and I expect about 200-250 people to attend.

Real quick about my dating background: I've never picked up a stranger in public that led to anything but I do ok online. In 2014 with Okcupid I went on about 40 first dates. I brought home/went home with about 20-22 of these women. So about 50% success rate. When I take a girl out from OKcupid for a drink I give it about 45 minutes in with successful conversation/flirting/touching.. if I'm making her laugh and feel I've connected at about 45 minutes I'll lean in a start kissing her. Make out- more drinks- more laughing half the time I can get them home.
So I've been at a bunch of these parties for this theater over the last 2 years. I have a good time, flirt with beautiful girls, they flirt back I engage with them but I always go home alone. I feel like I can't make my moves in this setting. It can even start to feel like a date if just me and one girl are locked in on each other for a while but I always think, ""well she didn't agree to go on a date with me we are just at this party together"". And everyone is here and anyone can see us and no one else is making out. SO how can I make any moves in this situation? How can I take a girl home from this event? I can think of about 6 who will be there that I'm dying to get. I have tried in the past towards the end of the night or when people start to leave to get the girl to go to another bar/location with me but I always get, ""I'm tired, I have to work tomorrow, I have to get to bed"" etc..

Any tips?! I really need them. Going home alone from these parties is starting to crush my spirit.
THANK YOU!",,False,,t5_2s30g,False,,male,True,t3_2p47dp,http://www.reddit.com/r/AskMen/comments/2p47dp/how_do_i_make_moves_at_a_public_party_serious/,
