created_utc,score,domain,id,title,author,ups,downs,num_comments,permalink,selftext,link_flair_text,over_18,thumbnail,subreddit_id,edited,link_flair_css_class,author_flair_css_class,is_self,name,url,distinguished
1416510175.0,136,self.AskWomen,2mwgp0,"All things holidays! Get your gift ideas, party ideas, and all else here. Megathread 2014!",poesie,136,0,583,http://www.reddit.com/r/AskWomen/comments/2mwgp0/all_things_holidays_get_your_gift_ideas_party/,"For those of you who love (or hate!) the holidays, we have decided to create a megathread to discuss it all to your heart's content.

Also, given the increase in people looking for Christmas gift ideas and in the interest of holiday cheer, we (the mods of /r/AskWomen) have decided to temporarily relax our rules and create a thread where anyone can get gift ideas.

For best results, give us a few details about the special people in your life, including age, your relationship to each other, length of relationship, and interests, as well as the price range you are looking for.

Askwomeners of reddit looking to help: Please remember to sort by ""new"" in order to see the latest!

Enjoy the thread everyone! Multiple submissions are encouraged.

All holiday posts will be redirected here so, everyone: please keep checking back on this post!
",,False,,t5_2rxrw,False,,female,True,t3_2mwgp0,http://www.reddit.com/r/AskWomen/comments/2mwgp0/all_things_holidays_get_your_gift_ideas_party/,
1418380358.0,489,self.AskWomen,2p2h1e,Does anyone else feel like their face attractiveness fluctuates daily?,hayberry,489,0,144,http://www.reddit.com/r/AskWomen/comments/2p2h1e/does_anyone_else_feel_like_their_face/,"I feel like I can look drastically different day to day. I know we're naturally less used to our own appearance since we don't look at ourselves all the time, but it honestly feels very dramatic to me: some days I feel like I look great, others it's like ""how could I have ever thought I could even be remotely attractive?"" I try to reason with myself, that it's not like I've ever noticed this in other people so why would they notice it in me, but I do feel like I get treated better on days when I feel like my face is behaving (though of course that could very well be self-fulfilling). Anyone else feel this way, or anyone know what it might be? Hormones? Emotional swings? My face actually morphing throughout the night?

Thanks!",,False,,t5_2rxrw,False,,female,True,t3_2p2h1e,http://www.reddit.com/r/AskWomen/comments/2p2h1e/does_anyone_else_feel_like_their_face/,
1418399159.0,38,self.AskWomen,2p343l,"Has anyone ever felt like they've ""outgrown"" their friends? What to do now?",smackem_yackem,38,0,26,http://www.reddit.com/r/AskWomen/comments/2p343l/has_anyone_ever_felt_like_theyve_outgrown_their/,"I'm in my early 40s and just don't feel like we have much in common anymore. I still love them, but can't relate, and feel like it's time to try and add to my group.  It feels a bit like a breakup.",,False,,t5_2rxrw,False,,,True,t3_2p343l,http://www.reddit.com/r/AskWomen/comments/2p343l/has_anyone_ever_felt_like_theyve_outgrown_their/,
1418407359.0,22,self.AskWomen,2p3iw4,Anyone here playing Dragon Age: Inquisition?,m00nf1r3,22,0,101,http://www.reddit.com/r/AskWomen/comments/2p3iw4/anyone_here_playing_dragon_age_inquisition/,"What are you playing as? Who are you romancing? What level are you? What do you love/hate about the game so far? 

I'm playing a female human rogue, dagger-style. I'm romancing Blackwall, because he's such a beastly hunk of man. Dat beard. I just hit level 14. I've been ALL OVER the world and only have 2 or 3 areas totally completed. I can't seem to stick to one area! There's so many side quests, it feels very Skyrim-ish, but I enjoy it. Never run out of things to do. I'm a total completionist, so I'm anal about exploring every nook and cranny of every area I go to. I have yet to try multi-player. 

What do ya'll think of the game so far?!",,False,,t5_2rxrw,False,,female,True,t3_2p3iw4,http://www.reddit.com/r/AskWomen/comments/2p3iw4/anyone_here_playing_dragon_age_inquisition/,
1418419912.0,9,self.AskWomen,2p4658,"There are a ton of bad relationship/worst breakup threads. What was the best relationship you've had, that you're no longer in, and why did it end?",QueenBuzzo,9,0,12,http://www.reddit.com/r/AskWomen/comments/2p4658/there_are_a_ton_of_bad_relationshipworst_breakup/,,,False,,t5_2rxrw,False,,female,True,t3_2p4658,http://www.reddit.com/r/AskWomen/comments/2p4658/there_are_a_ton_of_bad_relationshipworst_breakup/,
1418395040.0,33,self.AskWomen,2p2xgn,Has anyone here ever just picked up your life and moved some where new?,krcook510,33,0,54,http://www.reddit.com/r/AskWomen/comments/2p2xgn/has_anyone_here_ever_just_picked_up_your_life_and/,"The store I manage is closing for good New Years Eve. I left my long term boyfriend a few months ago. I live with my parents right now because my step dad has a disease in his back that makes it hard for him to walk and my mom needed help at the beginning. They are now doing just fine and have everything figured out. There is nothing holding me here. 

I've been looking at jobs all over the place and have been seriously considering just moving some where else. I'm 24 and I just feel like I need something big to happen in my life. I've put a lot of my life on hold to help family and friends. 

I'm just curious if anyone has ever done this and what your story is with it.

Edit: This is amazing feedback! I really think it is my time. I have a few places in mind where family lives. I also have a place where a friends parents live and they said I could crash with them until I get on my feet if that's where I choose to move. ",,False,,t5_2rxrw,1418403757.0,,,True,t3_2p2xgn,http://www.reddit.com/r/AskWomen/comments/2p2xgn/has_anyone_here_ever_just_picked_up_your_life_and/,
1418342872.0,427,self.AskWomen,2p0zdb,My 15 pound cat stepped on my throat last night. When was the last time your fur baby was an asshole?,CupcakeKim,427,0,356,http://www.reddit.com/r/AskWomen/comments/2p0zdb/my_15_pound_cat_stepped_on_my_throat_last_night/,"It was during that almost totally asleep phase too :( 

Here's a bonus picture of the culprit 
http://imgur.com/1cFydbb",,False,,t5_2rxrw,False,,female,True,t3_2p0zdb,http://www.reddit.com/r/AskWomen/comments/2p0zdb/my_15_pound_cat_stepped_on_my_throat_last_night/,
1418416016.0,8,self.AskWomen,2p3yw3,Your SO is the only man left in the world after a a deadly virus wipes out 99.9999999% of the male population. What does the rest of your life look like?,credy,8,0,44,http://www.reddit.com/r/AskWomen/comments/2p3yw3/your_so_is_the_only_man_left_in_the_world_after_a/,?,,False,,t5_2rxrw,False,,,True,t3_2p3yw3,http://www.reddit.com/r/AskWomen/comments/2p3yw3/your_so_is_the_only_man_left_in_the_world_after_a/,
1418415085.0,7,self.AskWomen,2p3x78,Ladies on birth control who've been effected emotionally - what happened when you realized you needed to stop taking the pill?,TheKittysMeow,7,0,16,http://www.reddit.com/r/AskWomen/comments/2p3x78/ladies_on_birth_control_whove_been_effected/,"I'm sure I am not alone on this one. I've recently realized (far too late) that the pills effecting me emotionally (&amp; physically). 

Two things. 

After crying like someone murdered my entire family when my bangs(yes my hair) weren't parting properly. 

Realizing I couldn't have a serious talk with my SO (happy convo's too) without becoming an emotional wreck, for no reason. 

Stories? ",,False,,t5_2rxrw,False,,,True,t3_2p3x78,http://www.reddit.com/r/AskWomen/comments/2p3x78/ladies_on_birth_control_whove_been_effected/,
1418403417.0,14,self.AskWomen,2p3bm0,"How did your parents discipline you as a child, and how has it affected you today and your relationship with your parents? Do you agree with their method? [TW?]",dostoyevskyy,14,0,63,http://www.reddit.com/r/AskWomen/comments/2p3bm0/how_did_your_parents_discipline_you_as_a_child/,"What would be seen as extreme child abuse now-a-days was the normative form of disciplinary action in my family when I was a kid. Everyone was subject to spanking, belt/slipper/wooden spoon/coat hanger whippings. It often seemed like my parents were lashing their angers out on me, and my father would say things along the lines of ""this is what you get"", ""I dare you to try that again"" and just odd, demoralizing phrases during the whippings. And I distinctly remember them lasting a very long time, hovering around 25 minutes, followed by hours of being placed in isolation. My cousins had it even worse than my siblings and I, however, and their parents would punch and kick them as well.

But today, I'm a very level headed, compassionate person, and my siblings and I, alongside our cousins, have very close relationships with our parents. It's as though that part of my childhood did not happen. I love my parents more than anything, my mother is so generous and I find my father admirable hardworking. It hasn't caused any strain in our relationship now (though we did have a sticky past where social workers were involved). And the experience is pretty neutral to me. Maybe there's a cultural aspect to it, but I am Asian Canadian, and rather crude disciplinary action was the normative among other Asian peers of mine as well. We would share our similarity in beatings and find it quite laughable how close in nature they were. But we all still hold very deep, close and affectionate/loving/respectful relationships with our parents.

I don't want children, but if I hypothetically did, I would not use physical discipline, or ""corporal punishment"" as the legal Canadian terms define it.

So ladies, mind telling me your stories and their effects on yourself as a being today, and your relationship with your parents?",,False,,t5_2rxrw,False,,,True,t3_2p3bm0,http://www.reddit.com/r/AskWomen/comments/2p3bm0/how_did_your_parents_discipline_you_as_a_child/,
1418410817.0,8,self.AskWomen,2p3pa0,Have you had a friend ditch you for their romantic relationship?,Tuala08,8,0,36,http://www.reddit.com/r/AskWomen/comments/2p3pa0/have_you_had_a_friend_ditch_you_for_their/,"As in, not just ditching you one time, but they basically stop being your friend because they now have a boyfriend or girlfriend.  What did you do? What happened when they broke up?",,False,,t5_2rxrw,False,,female,True,t3_2p3pa0,http://www.reddit.com/r/AskWomen/comments/2p3pa0/have_you_had_a_friend_ditch_you_for_their/,
1418408451.0,7,self.AskWomen,2p3kxe,"If you could write a song about Christmas but wanted to write about something fresh, what would that topic be?",TXSC,7,0,42,http://www.reddit.com/r/AskWomen/comments/2p3kxe/if_you_could_write_a_song_about_christmas_but/,"If you were to write a Christmas song but didn't want to do something ""done to death"", what would the topic be?  

This post is not meant as a gift or to be for or about anyone in particular.  I was just wondering what topics you would like to see in a Christmas song.

x-post from /r/askmen

tl;dr: What topic would you choose for a Christmas song?",,False,,t5_2rxrw,False,,male,True,t3_2p3kxe,http://www.reddit.com/r/AskWomen/comments/2p3kxe/if_you_could_write_a_song_about_christmas_but/,
1418397820.0,14,self.AskWomen,2p31t4,"AskWomen moms, what was your ""trying to get pregnant"" like?",throwaway293724,14,0,20,http://www.reddit.com/r/AskWomen/comments/2p31t4/askwomen_moms_what_was_your_trying_to_get/,"I apologize, I can't think of a better way to word that question. My wife and I have been ""trying"" for a couple of months now. She got her period yesterday and was bummed, I guess she had the feeling like it had happened. I just told her no worries and we'd get there, not to worry.

I'm sure it's different for everybody, but I was curious what your sex frequency was like? How long did it take you to get pregnant?

Also uh...any tricks for the fairly obvious ""avoiding drinking"" thing? Christmas soon. Fucking people, man. ""No wine? YA PREGNANT OR SOMETHING? What the hell?",,False,,t5_2rxrw,False,,,True,t3_2p31t4,http://www.reddit.com/r/AskWomen/comments/2p31t4/askwomen_moms_what_was_your_trying_to_get/,
1418408370.0,8,self.AskWomen,2p3ks6,"Traveling women of Reddit, any tips for India?",0909a0909,8,0,25,http://www.reddit.com/r/AskWomen/comments/2p3ks6/traveling_women_of_reddit_any_tips_for_india/,"Mumbai, Karnataka and Goa to be precise. I'll be traveling with my SO, sister and her husband.",,False,,t5_2rxrw,False,,,True,t3_2p3ks6,http://www.reddit.com/r/AskWomen/comments/2p3ks6/traveling_women_of_reddit_any_tips_for_india/,
1418415631.0,3,self.AskWomen,2p3y7h,Have you ever had an orgasm during a dream that woke you up and it carried over to actually happening in reality?,sirco,3,0,26,http://www.reddit.com/r/AskWomen/comments/2p3y7h/have_you_ever_had_an_orgasm_during_a_dream_that/,"Had a friend tell me this happened to her and my mind was blowned...how often does it happen? Is it a touchless ""O"" once you wake up or does it require manual assistance? :)",,True,,t5_2rxrw,False,,,True,t3_2p3y7h,http://www.reddit.com/r/AskWomen/comments/2p3y7h/have_you_ever_had_an_orgasm_during_a_dream_that/,
1418406630.0,3,self.AskWomen,2p3hgk,Would you rather have back your best pet or have a relationship with the person you most desire?,lollibut,3,0,44,http://www.reddit.com/r/AskWomen/comments/2p3hgk/would_you_rather_have_back_your_best_pet_or_have/,"Fairy godmother gives you a choice, you can have your best pet ever restored to you alive, young and in full health, or you can have a relationship with the person for whom you feel the most sexual attraction and that person will be totally and completely besotted with you.

Choose.",,False,,t5_2rxrw,False,,female,True,t3_2p3hgk,http://www.reddit.com/r/AskWomen/comments/2p3hgk/would_you_rather_have_back_your_best_pet_or_have/,
1418379296.0,15,self.AskWomen,2p2g02,"What is the most random, yet coolest thing you have bought off of Amazon?",BlackOptimist,15,0,37,http://www.reddit.com/r/AskWomen/comments/2p2g02/what_is_the_most_random_yet_coolest_thing_you/,,,False,,t5_2rxrw,False,,male,True,t3_2p2g02,http://www.reddit.com/r/AskWomen/comments/2p2g02/what_is_the_most_random_yet_coolest_thing_you/,
1418411568.0,2,self.AskWomen,2p3qqk,"I suck at wearing high heels, it hurts too much. Would a thick, chunky heel make it easier?",TXSE,2,0,25,http://www.reddit.com/r/AskWomen/comments/2p3qqk/i_suck_at_wearing_high_heels_it_hurts_too_much/,"My feet hurt when I wear high heels, so I always have to pack a pair of flats in my purse and change shoes after a few hours because it just aches so much I almost start walking funny. I don't like the way I look when I'm *all dressed up* but wearing flats or sneakers, so I really want to learn how walk in heels. Would shoes with heels like [this](http://i00.i.aliimg.com/wsphoto/v0/744495070/Free-shipping-fashion-girls-2013-spring-new-arrive-platform-pumps-chunky-high-heels-ladies-shoes-woman.jpg) help? They wouldn't have to be as tall, though. I almost bought a pair today, but I wanted to hear what the common consesus is first.",,False,,t5_2rxrw,False,,,True,t3_2p3qqk,http://www.reddit.com/r/AskWomen/comments/2p3qqk/i_suck_at_wearing_high_heels_it_hurts_too_much/,
1418417286.0,0,self.AskWomen,2p416m,Is telling someone that you won't want to stay friends with them in the event of a breakup coercive behavior?,eggtymer,0,0,13,http://www.reddit.com/r/AskWomen/comments/2p416m/is_telling_someone_that_you_wont_want_to_stay/,,,False,,t5_2rxrw,False,,,True,t3_2p416m,http://www.reddit.com/r/AskWomen/comments/2p416m/is_telling_someone_that_you_wont_want_to_stay/,
1418415036.0,1,self.AskWomen,2p3x3s,Do you ever get turned on by things completely unrelated to sex? Maybe because you've accidentally trained your body to do so?,MTRXGRL,1,0,6,http://www.reddit.com/r/AskWomen/comments/2p3x3s/do_you_ever_get_turned_on_by_things_completely/,"So, it's finals week, and my university offers free yoga classes to help relax a little for our end of the year tests and stuff. My roommate and a friend of ours decided to go and check it out, and everything was going really, really well (seriously, everyone should try yoga at least once, it's truly wonderful) until we started doing positions that really stretched the backs of my thighs and knees.

I started getting really, really turned on. I'm not unaccustomed to being turned on in public (it happens and is easy to hide) but these positions were actually making me wet, and I almost orgasmed during the class.
So, obviously, I'm like what the hell is going on with my body? I thought about it a lot last night, and had a thought:

When I first started masturbating, it was in the shower. Sorry this is so graphic, but I used to stretch my legs against the wall of the tub and let the pressure from the faucet run over my clit. While doing this I often had to stretch my legs a lot, and I think because of this semi-regular process, I've trained my body to be turned on and ultimately prepare itself for an orgasm whenever my legs are stretched.

Could this be a real thing? Has anyone else experienced something similar? Or am I actually crazy and just turned on by downward dog for some inexplicable reason?",,False,,t5_2rxrw,False,,,True,t3_2p3x3s,http://www.reddit.com/r/AskWomen/comments/2p3x3s/do_you_ever_get_turned_on_by_things_completely/,
1418423007.0,0,self.AskWomen,2p4brr,"How would you respond to a person that thinks make up and spanks are ""deceitful""?",oatmealcookay,0,0,17,http://www.reddit.com/r/AskWomen/comments/2p4brr/how_would_you_respond_to_a_person_that_thinks/,"I don't feel this way, but I've run across many who do.",,False,,t5_2rxrw,False,,,True,t3_2p4brr,http://www.reddit.com/r/AskWomen/comments/2p4brr/how_would_you_respond_to_a_person_that_thinks/,
1418368511.0,14,self.AskWomen,2p25at,How many friends do you have?,jewelie34,14,0,60,http://www.reddit.com/r/AskWomen/comments/2p25at/how_many_friends_do_you_have/,"I feel like I have a plethora of ""friends"" - as in better than acquaintances, but not, love you forever friends. One of my dearest friends is moving at least a thousand miles away and I'm really upset. I know we're a plane trip away, but when you are use to seeing someone regularly, and then can't all of the sudden, it's tear worthy. Plus - now who am I going to have wine with and dish about my SO?? I would love to hear some stories about long-distance friendships. :)",,False,,t5_2rxrw,False,,,True,t3_2p25at,http://www.reddit.com/r/AskWomen/comments/2p25at/how_many_friends_do_you_have/,
1418381504.0,7,self.AskWomen,2p2i2l,Who here DOESN'T like getting hugs from their SO or close friends?,saddetective87,7,0,32,http://www.reddit.com/r/AskWomen/comments/2p2i2l/who_here_doesnt_like_getting_hugs_from_their_so/,"And why? My gf loves it when I just randomly hug her (she loves hugs in general), along with other things....
",,False,,t5_2rxrw,False,,,True,t3_2p2i2l,http://www.reddit.com/r/AskWomen/comments/2p2i2l/who_here_doesnt_like_getting_hugs_from_their_so/,
1418418893.0,0,self.AskWomen,2p44ak,"At the close of a first date, do you think it's better for a man to ask if you'd like be walked to your car, or just volunteer and say ""I'll walk you to your car"".",ImTheModerator,0,0,13,http://www.reddit.com/r/AskWomen/comments/2p44ak/at_the_close_of_a_first_date_do_you_think_its/,"I've always volunteered to do so out of politeness, since most dates are at night and parking lots can be scary. 

Lately I've thought about it and *telling* them seems a bit presumptuous. I think it would be better to ask.

What are your thoughts?

*Disclaimer* Please pay my screenname no mind, I don't mod this sub but I plan to create a few unrelated subs shortly)",,False,,t5_2rxrw,False,,male,True,t3_2p44ak,http://www.reddit.com/r/AskWomen/comments/2p44ak/at_the_close_of_a_first_date_do_you_think_its/,
1418385628.0,4,self.AskWomen,2p2m3i,"Ladies, after a crap or sad day what was something your SO did that made you instantly happy?",saddetective87,4,0,21,http://www.reddit.com/r/AskWomen/comments/2p2m3i/ladies_after_a_crap_or_sad_day_what_was_something/,,,False,,t5_2rxrw,False,,,True,t3_2p2m3i,http://www.reddit.com/r/AskWomen/comments/2p2m3i/ladies_after_a_crap_or_sad_day_what_was_something/,
1418383004.0,4,self.AskWomen,2p2jg6,"Ladies, have you ever had an SO with a lower sex drive than you? Did you take it personally?",breeleep,4,0,30,http://www.reddit.com/r/AskWomen/comments/2p2jg6/ladies_have_you_ever_had_an_so_with_a_lower_sex/,,,False,,t5_2rxrw,False,,,True,t3_2p2jg6,http://www.reddit.com/r/AskWomen/comments/2p2jg6/ladies_have_you_ever_had_an_so_with_a_lower_sex/,
1418413256.0,1,self.AskWomen,2p3tu3,"We've all heard the adage ""beer before liquor, never sicker."" What is your best rhyming sage advice?",blestinthechessed,1,0,20,http://www.reddit.com/r/AskWomen/comments/2p3tu3/weve_all_heard_the_adage_beer_before_liquor_never/,"I personally like

&gt;*Coffee before food,* ***duuuuuuuude...***",,False,,t5_2rxrw,False,,female,True,t3_2p3tu3,http://www.reddit.com/r/AskWomen/comments/2p3tu3/weve_all_heard_the_adage_beer_before_liquor_never/,
1418299514.0,309,self.AskWomen,2oysea,What was the most inappropriate place when a guy tried to hit on you?,not_again123,309,0,876,http://www.reddit.com/r/AskWomen/comments/2oysea/what_was_the_most_inappropriate_place_when_a_guy/,"A place where you just thought:""Realy? You try to pull this of here?""

Also, is there a place where you want/prefer to be hit on? Like at work, a party or something?

Edit: Wow, there are realy dudes who have no idea about the time or the place, to where to talk to a women.",,False,,t5_2rxrw,1418302350.0,,,True,t3_2oysea,http://www.reddit.com/r/AskWomen/comments/2oysea/what_was_the_most_inappropriate_place_when_a_guy/,
1418397459.0,1,self.AskWomen,2p317l,Do you think it's low-class to make out at parties?,holdmeloveme,1,0,30,http://www.reddit.com/r/AskWomen/comments/2p317l/do_you_think_its_lowclass_to_make_out_at_parties/,"Like small parties, not huge ones. And like, not in a bedroom, but on a sofa or something in front of everyone. ",,False,,t5_2rxrw,False,,,True,t3_2p317l,http://www.reddit.com/r/AskWomen/comments/2p317l/do_you_think_its_lowclass_to_make_out_at_parties/,
1418363745.0,11,self.AskWomen,2p1z8o,What are your favorite cover songs?,oatmealcookay,11,0,50,http://www.reddit.com/r/AskWomen/comments/2p1z8o/what_are_your_favorite_cover_songs/,"[I'm addicted to this one right now](https://www.youtube.com/watch?v=-ntdDEJvfZ4)

[Original](https://www.youtube.com/watch?v=bbqVg_23otg)",,False,,t5_2rxrw,False,,,True,t3_2p1z8o,http://www.reddit.com/r/AskWomen/comments/2p1z8o/what_are_your_favorite_cover_songs/,
1418334204.0,45,self.AskWomen,2p0i6a,How do you browse reddit without letting it turn you into a misandrist?,singlecuriosity,45,0,164,http://www.reddit.com/r/AskWomen/comments/2p0i6a/how_do_you_browse_reddit_without_letting_it_turn/,"I swear that growing up I used to believe that men were mostly nice people,  that equality was on the way to being a thing,  and everything was optimistic and flowery and people were great. 

Then I found freaking reddit. 

Is not just the views themselves, is how FREQUENTLY this sexist shit is always on my front page,  on askmen, and getting upvoted every DAY. I haven't been able to browse anywhere without coming upon some sort of 'women suck' sentiment of some description every few hours that's heavily agreed with. 

This is seriously getting me down. I didn't even believe in any kind of gender war,  but apparently there's one happening all the time orchestrated by these evil spermjackjng rape accusing female overlords? Wtf.

I used to view men as people.  Reddit is starting to make me view them as something dangerous that doesn't view me as a human being. 

How do I fix this?!",,False,,t5_2rxrw,False,,,True,t3_2p0i6a,http://www.reddit.com/r/AskWomen/comments/2p0i6a/how_do_you_browse_reddit_without_letting_it_turn/,
1418407794.0,2,self.AskWomen,2p3jo9,[Serious] How do you deal with PMSing?,sararooskie,2,0,10,http://www.reddit.com/r/AskWomen/comments/2p3jo9/serious_how_do_you_deal_with_pmsing/,"Hi all,

It's mine and my partner's anniversary. We both are very, very busy so we don't get days off together very often. We actually have 24 hours off together today to celebrate our special day. We're going to the spa, getting a hotel room, etc.

The only issue is I'm PMSing REALLY bad. I get super hormonal and emotional. I cramp really hard and I'm generally really on edge and snappy.

I need some advice here: what are your tips and tricks to deal with this time of the month so you're not such a pain in the ass to deal with? ",,False,,t5_2rxrw,False,,,True,t3_2p3jo9,http://www.reddit.com/r/AskWomen/comments/2p3jo9/serious_how_do_you_deal_with_pmsing/,
1418406305.0,0,self.AskWomen,2p3gun,What am I supposed to call your vagina when I'm talking to you??,animusbulldog,0,0,30,http://www.reddit.com/r/AskWomen/comments/2p3gun/what_am_i_supposed_to_call_your_vagina_when_im/,"23/M here. If/when I'm talking dirty to my girlfriend, what am I supposed to call it?
I feel like vagina is too formal and some girls don't like ""pussy "". What do you like your SO to call it when the time's right? ",,True,,t5_2rxrw,False,,,True,t3_2p3gun,http://www.reddit.com/r/AskWomen/comments/2p3gun/what_am_i_supposed_to_call_your_vagina_when_im/,
1418337779.0,36,self.AskWomen,2p0pdy,What makes you happy (that's not dating/sex/relationship related)?,swimmiee,36,0,101,http://www.reddit.com/r/AskWomen/comments/2p0pdy/what_makes_you_happy_thats_not/,"I really like gardening, fashion, food (I'm a vegetarian who loves cooking), animals, playing with children, exercise, studying chemistry and biology, listening to reggae, and talking to new people. 

What are your sources of happiness?",,False,,t5_2rxrw,False,,,True,t3_2p0pdy,http://www.reddit.com/r/AskWomen/comments/2p0pdy/what_makes_you_happy_thats_not/,
