created_utc,score,domain,id,title,author,ups,downs,num_comments,permalink,selftext,link_flair_text,over_18,thumbnail,subreddit_id,edited,link_flair_css_class,author_flair_css_class,is_self,name,url,distinguished
1418415206.0,3,self.shortscarystories,2p3xf2,Save Yourself,thatcoolguymike,3,0,2,http://www.reddit.com/r/shortscarystories/comments/2p3xf2/save_yourself/,"I was no match for the enormous ocean waves that suppressed my 

survival efforts. My boat though still upright was unreachable from my
 
submerged state.


 I realized my doom and accepted death with reluctantly open arms. The

 ocean's darkness was suddenly reversed to a blinding light. Though I 

couldn't see anything, I could hear a divine voice. ""You have one chance 

to go back and rescue yourself for only a minor toll-"" I did not wait for 

the voice to continue, I just yelled and shrieked. ""Yes! Yes! I want to go
 
back, yes!""


 I was instantly transported to the safety of my boat. I saw someone 

drowning out of the corner of my eye, it was me from moments ago. I 

extended my arm to my other self who of course instinctively clenched 

onto my hand, making a solid fist. 


As I hoisted him aboard, I felt a sudden and familiar fear as I lost my 

balance and fell into the sea. I saw my other self climbing onto to the 

boat, wearing a wicked smile. He waved to me as I realized my folly and

 sunk deeper into the infinite darkness of the ocean. 


If only I had known the toll of this opportunity. I once again accepted 

my imminent demise and waited for the bright light, but there was none.



 This time, there was only darkness.",,False,,t5_2t6kz,False,,,True,t3_2p3xf2,http://www.reddit.com/r/shortscarystories/comments/2p3xf2/save_yourself/,
1418320621.0,199,self.shortscarystories,2ozq00,Amy,krshann,199,0,16,http://www.reddit.com/r/shortscarystories/comments/2ozq00/amy/,"I didn't know I had the power to bring back the dead until I touched a man who had stopped breathing. 

I had seen him fall, clutching his chest, blue in the face. I ran over and joined the group who was circling around him, while his wife yelled for someone to call 911. 
Knowing CPR, I readied the man and breathed the breath of life back into him. He was up almost immediately, thanking me, crying, and holding his wife.
I saved his life.
And now I do the same for others.

---

When Amy came back, she started crying. It was surprising because most people give a wide-eyed look like they can't believe, but not Amy. Amy was crying. She was my favorite, and here she was, sobbing.

I shook my finger in her direction.

""No, Amy,"" I scolded. She made a grunting noise behind the tape and tears drove down her cheeks, mixing with the blood and sweat that already lingered there. Her body was covered in blood, but she had no wounds.

""That's right, Amy,"" I whispered, brushing her dirty, sweat soaked hair back from her forehead. ""You've always been the best, Amy."" I tell her, grabbing the knife off the table.

""Just you and me, Amy,"" I console her, stroking her hair. I slit her throat and watch blood pour down the front of her blouse. After a few minutes, the blood flow stops and I kiss her lips tenderly. I part them softly and exhale a small breath into her. Almost instantaneously she comes back.

""Just you and me.""
",,False,,t5_2t6kz,False,,,True,t3_2ozq00,http://www.reddit.com/r/shortscarystories/comments/2ozq00/amy/,
1418369452.0,16,self.shortscarystories,2p26g2,[Christmas Contest] I See Santa Everyday,ThisIsMarkSantiago,16,0,2,http://www.reddit.com/r/shortscarystories/comments/2p26g2/christmas_contest_i_see_santa_everyday/,"Two years ago when I was six, I woke up in the middle of the night before Christmas.  
I was walking back from the comfort room cause I needed to pee.  
And that's the first time I saw Santa.  
I saw him went inside my grandpa's room.  
He must be leaving his gift for him.  
I mischievously waited for him in my room.  
And the next thing I remember?  
I woke up on Christmas day with a gift in my room like everybody else in our house.  
But the sad thing is, grandpa never woke up.  
That's when I started hating Christmas.  
.  
Today, I cleared all my doubts.  
I just realized how impossible Santa could exist.  
And two years ago, that guy can't be Santa.  
Cause Santa should be wearing red not black,  
And should be carrying a sack, not a scythe.  
At least today I can stop bragging my friends  
That I see Santa everyday.",,False,,t5_2t6kz,False,,,True,t3_2p26g2,http://www.reddit.com/r/shortscarystories/comments/2p26g2/christmas_contest_i_see_santa_everyday/,
1418422777.0,1,self.shortscarystories,2p4bee,[Christmas Contest]Christmas wishes,stupidrobots,1,0,0,http://www.reddit.com/r/shortscarystories/comments/2p4bee/christmas_contestchristmas_wishes/,"They say christmas is a magical time when miracles can happen if you want them badly enough.  Well shit, this year I have a lot of wishes.

I wish I didn't drink so much.  I wish I didn't piss my wife off so much.  I wish I was there more for my kids.  I wish I didn't have to sell my old comic books to pay for this santa suit.  I wish I knew my wife had taken the kids to her mother's.  I wish they were home.  I wish I was 30 pounds lighter.  Most of all, I wish someone could hear me in screaming in this chimney.",,False,,t5_2t6kz,False,,,True,t3_2p4bee,http://www.reddit.com/r/shortscarystories/comments/2p4bee/christmas_contestchristmas_wishes/,
