created_utc,score,domain,id,title,author,ups,downs,num_comments,permalink,selftext,link_flair_text,over_18,thumbnail,subreddit_id,edited,link_flair_css_class,author_flair_css_class,is_self,name,url,distinguished
1418077971.0,21,self.shortscarystories,2ooxc2,Christmas Contest!,Mx-yz-pt-lk,21,0,20,http://www.reddit.com/r/shortscarystories/comments/2ooxc2/christmas_contest/,"Rules:


1) All SSS rules must be followed


2) The story has to involve Christmas in some way. 


3) [Christmas Contest] needs to be in the title. If it's not then we won't see your post when we search for the top ten. 


Contest ends Christmas Day. The winner will be picked by the mods from the ten most upvoted stories and  will receive custom flair, have their story narrated on chillingtalesfordarknights.com, and will be January's writer of the month! 


Edit: Thank you /u/The_Demon_Barber for reminding me that the winner will also receive a picture of a super crazy adorable baby animal. ",,False,,t5_2t6kz,1418183601.0,,,True,t3_2ooxc2,http://www.reddit.com/r/shortscarystories/comments/2ooxc2/christmas_contest/,moderator
1418406211.0,34,self.shortscarystories,2p3gnv,The Lotion,krshann,34,0,10,http://www.reddit.com/r/shortscarystories/comments/2p3gnv/the_lotion/,"I had seen all the unbelievable commercials. Seen all of the belts, pills, elliptical/treadmill hybrids the mind could possibly invent. Eating my feelings, not exercising...it's a quick slide to the bottom of the physical fitness scale. But of course, like I said, I knew better than to trust those commercials. 

The lotion was a gift.

My husband had bought it for me. A nice surprise, really, since I felt our marriage had been slowing down the past few years. His unwillingness to maintain physical contact, his averted gaze whenever we spoke... Richard had always been a nice guy but suddenly he'd changed, becoming a person I didn't know. He wasn't attracted to me, wanted a divorce. I wanted to work it out.

But the lotion was a peace offering. 

""It's a gift, from a medicine woman,"" he said, giving me a small smile. ""She uses it to help those who want to lose weight but conventional methods seem to not work."" I kissed him gently, thanking him for the gift. I was happy he was making an effort again.

That night, after I got out of the tub, I rubbed the lotion on my body, legs first. Richard had told me that I needed to make sure to rub it in...the heat of the rubbing activates it.

I waited.

Waited.

Burning sensations started. My body was overwhelmingly hot, boiling under the lotion. The skin started to peel and I began to panic. As I stood up to make my way back to the shower to rinse it off, skin began decomposing and sliding off my bones.  I screamed.

 And Richard laughed.
",,False,,t5_2t6kz,1418410052.0,,,True,t3_2p3gnv,http://www.reddit.com/r/shortscarystories/comments/2p3gnv/the_lotion/,
1418394229.0,44,self.shortscarystories,2p2wan,[Christmas Contest] SantaCorp,MikeTheBoomer,44,0,1,http://www.reddit.com/r/shortscarystories/comments/2p2wan/christmas_contest_santacorp/,"This is how Christmas works these days.  You have a child and then wait for what seems like months for a chance to meet Santa Claus.  If we had any choice, we wouldn't have queued in the snow and freezing temperatures for hours to see him.  The truth is we can't afford not to.

Finally, my wife, Ria, and I are next in line.  An elf with a clipboard takes our details and then begins running through a prepared script.

""You understand that in donating you first born child to SantaCorp, any and all children you have in the future will be provided with free gifts at Christmastime?""
 
""Yes."" I answer.

""You understand that once you enter Santa's grotto you cannot back out of the deal and the process must be completed?""

""Yes.""

""You understand that if either of you close your eyes or look away during the procedure the agreement will be void and SantaCorp will not acknowledge your donation?""

""Yes.""

""Okay.  Step through the double doors when you're ready.  He will see you now.""

Ria grabs my hand tightly as she holds our child to her chest.  I can see her eyes filling with tears as we step through the double doors.

The sight of him makes me gag.  His suit may once have been well-fitting, but his large, hairy stomach has ripped through it and rests on his lap.  His long grey hair and beard haven't been washed for some time; they are tangled and matted with blood.

I can't decide what's worse about this situation; the fact that he will devour our only child or that we have to watch.",,False,,t5_2t6kz,False,,,True,t3_2p2wan,http://www.reddit.com/r/shortscarystories/comments/2p2wan/christmas_contest_santacorp/,
1418402583.0,18,self.shortscarystories,2p3a29,Rush Hour,AwilsonLondon,18,0,1,http://www.reddit.com/r/shortscarystories/comments/2p3a29/rush_hour/,"The train came into the tunnel, as crowds flooded the platform and bottle-necked the doors, Jon realized he was going to miss this train too. He was too unassertive to battle the more aggressive commuters who were more than happy to push him out of the way. The train took off and the wind misplaced his ever so carefully combed hair, he swore to himself that he would make the next train. It was only now the train passed that he paid attention to the adverts on the back wall. Most of them were trying too sell you on the idea of parting with your cash. Among these was a travel advertisement, the tagline read,
 ""What Are You Waiting For?"",
The clock read, next train 1 minute, he loosened his color from his throat as the next train emerged at the end of the tunnel. Jon thought to himself it's time to go. He placed his hands faintly on the back of the person just in front, then fixed his feet firm to the floor, before whispering into their ear,
 ""I can push too""..... ",,False,,t5_2t6kz,False,,,True,t3_2p3a29,http://www.reddit.com/r/shortscarystories/comments/2p3a29/rush_hour/,
1418352344.0,207,self.shortscarystories,2p1gia,Six Little Children [Christmas Contest],IPostAtMidnight,207,0,16,http://www.reddit.com/r/shortscarystories/comments/2p1gia/six_little_children_christmas_contest/,"Father clapped his hands loudly to silence the noisy house.

""Now then,"" he said, ""are all you children ready for bed? Before you scamper off to dream of stockings and sugar-plums, Grandmother will tell you a story.""

The old woman hummed to herself while they gathered on the floor around her rocking chair. Once they grew quiet again, she spoke over the soft crackling of the fireplace. ""When I was a girl, there was a tradition of telling scary ghost stories on Christmas Eve. But not this year. This year, I'm going to tell you the truth. Would you like that?""

Sleepy heads nodded. Grandmother cleared her throat and began to recite a poem.

&amp;nbsp;

""Six little children, all in a row.    
Which one will be dragged out into the snow?    
Santa brings gifts but he takes a gift too,    
Each year a young tribute, as is his due.    
He works them to death making next year's toys,    
Those we call elves, who were once girls and boys.    
But Santa weaves magic and once morning dawns,    
Good children forget the bad one who's gone.    
So which of you six was the naughtiest tot?    
Can't hide from Santa, you're sure to be--""

&amp;nbsp;

""But Grandma!"" the smallest girl interrupted, then covered her mouth.

""Yes, dear?""

In a tiny voice, almost a whisper, the girl continued.

""There are only five of us.""

Grandmother leaned forward, raised her spectacles, and slowly counted the children around her chair. When her finger reached an empty spot, she stopped.

""My goodness, so there are. I'm getting forgetful, too.""

Then she leaned back and began again.

""Five little children, all in a row...""",,False,,t5_2t6kz,False,,,True,t3_2p1gia,http://www.reddit.com/r/shortscarystories/comments/2p1gia/six_little_children_christmas_contest/,
1418421481.0,4,self.shortscarystories,2p490a,Higher Power,crimsonire92,4,0,1,http://www.reddit.com/r/shortscarystories/comments/2p490a/higher_power/,"Even with wings outstretched, the look of it was anything but holy. Its body torn asunder, pure energy pouring out from within holes gouged deep into its flesh; a strange malevolence emanated from it.

Within its chamber, black wisps of cold technology extended outward from a base beneath the thing, waves of the same terrible energy coursing through. Its crimson eyes stared onward, beyond me; a feeling that it could somehow see through me, into the deepest recesses of my soul inhabited me whenever I looked upon it.

I knew better though; it had been years since we had discovered them, and countless studies until we fully understood them.

Understood their value.

I turned back to my monitor, London was experiencing a brown out in the third quarter and a red bar flashed consistently across my screen. With a swiping motion I cleared the alert, activating backup generators to pull in the extra energy needed. 

Sweeping black tendrils instantly coalesced, pushing themselves deep into several of the glowing holes in the things form. It stood steady, unmoved and seemingly unfazed; the potent energy flowing outward through the cables to London.

The thing about Angels, is they don't feel pain. They don't seem to feel anything, in fact; which is why they are so perfectly used in this capacity. 

But those eyes, they are always staring. Its unnerving, how they almost seem to be watching for something; waiting.

Those words are on the screen again, the ones I try to ignore; the red ones. They're different this time though, something that chills me to the bone:

*The Chariots are coming...*",,False,,t5_2t6kz,False,,,True,t3_2p490a,http://www.reddit.com/r/shortscarystories/comments/2p490a/higher_power/,
1418415206.0,3,self.shortscarystories,2p3xf2,Save Yourself,thatcoolguymike,3,0,2,http://www.reddit.com/r/shortscarystories/comments/2p3xf2/save_yourself/,"I was no match for the enormous ocean waves that suppressed my 

survival efforts. My boat though still upright was unreachable from my
 
submerged state.


 I realized my doom and accepted death with reluctantly open arms. The

 ocean's darkness was suddenly reversed to a blinding light. Though I 

couldn't see anything, I could hear a divine voice. ""You have one chance 

to go back and rescue yourself for only a minor toll-"" I did not wait for 

the voice to continue, I just yelled and shrieked. ""Yes! Yes! I want to go
 
back, yes!""


 I was instantly transported to the safety of my boat. I saw someone 

drowning out of the corner of my eye, it was me from moments ago. I 

extended my arm to my other self who of course instinctively clenched 

onto my hand, making a solid fist. 


As I hoisted him aboard, I felt a sudden and familiar fear as I lost my 

balance and fell into the sea. I saw my other self climbing onto to the 

boat, wearing a wicked smile. He waved to me as I realized my folly and

 sunk deeper into the infinite darkness of the ocean. 


If only I had known the toll of this opportunity. I once again accepted 

my imminent demise and waited for the bright light, but there was none.



 This time, there was only darkness.",,False,,t5_2t6kz,False,,,True,t3_2p3xf2,http://www.reddit.com/r/shortscarystories/comments/2p3xf2/save_yourself/,
1418320621.0,196,self.shortscarystories,2ozq00,Amy,krshann,196,0,16,http://www.reddit.com/r/shortscarystories/comments/2ozq00/amy/,"I didn't know I had the power to bring back the dead until I touched a man who had stopped breathing. 

I had seen him fall, clutching his chest, blue in the face. I ran over and joined the group who was circling around him, while his wife yelled for someone to call 911. 
Knowing CPR, I readied the man and breathed the breath of life back into him. He was up almost immediately, thanking me, crying, and holding his wife.
I saved his life.
And now I do the same for others.

---

When Amy came back, she started crying. It was surprising because most people give a wide-eyed look like they can't believe, but not Amy. Amy was crying. She was my favorite, and here she was, sobbing.

I shook my finger in her direction.

""No, Amy,"" I scolded. She made a grunting noise behind the tape and tears drove down her cheeks, mixing with the blood and sweat that already lingered there. Her body was covered in blood, but she had no wounds.

""That's right, Amy,"" I whispered, brushing her dirty, sweat soaked hair back from her forehead. ""You've always been the best, Amy."" I tell her, grabbing the knife off the table.

""Just you and me, Amy,"" I console her, stroking her hair. I slit her throat and watch blood pour down the front of her blouse. After a few minutes, the blood flow stops and I kiss her lips tenderly. I part them softly and exhale a small breath into her. Almost instantaneously she comes back.

""Just you and me.""
",,False,,t5_2t6kz,False,,,True,t3_2ozq00,http://www.reddit.com/r/shortscarystories/comments/2ozq00/amy/,
1418369452.0,15,self.shortscarystories,2p26g2,[Christmas Contest] I See Santa Everyday,ThisIsMarkSantiago,15,0,2,http://www.reddit.com/r/shortscarystories/comments/2p26g2/christmas_contest_i_see_santa_everyday/,"Two years ago when I was six, I woke up in the middle of the night before Christmas.  
I was walking back from the comfort room cause I needed to pee.  
And that's the first time I saw Santa.  
I saw him went inside my grandpa's room.  
He must be leaving his gift for him.  
I mischievously waited for him in my room.  
And the next thing I remember?  
I woke up on Christmas day with a gift in my room like everybody else in our house.  
But the sad thing is, grandpa never woke up.  
That's when I started hating Christmas.  
.  
Today, I cleared all my doubts.  
I just realized how impossible Santa could exist.  
And two years ago, that guy can't be Santa.  
Cause Santa should be wearing red not black,  
And should be carrying a sack, not a scythe.  
At least today I can stop bragging my friends  
That I see Santa everyday.",,False,,t5_2t6kz,False,,,True,t3_2p26g2,http://www.reddit.com/r/shortscarystories/comments/2p26g2/christmas_contest_i_see_santa_everyday/,
1418422777.0,1,self.shortscarystories,2p4bee,[Christmas Contest]Christmas wishes,stupidrobots,1,0,0,http://www.reddit.com/r/shortscarystories/comments/2p4bee/christmas_contestchristmas_wishes/,"They say christmas is a magical time when miracles can happen if you want them badly enough.  Well shit, this year I have a lot of wishes.

I wish I didn't drink so much.  I wish I didn't piss my wife off so much.  I wish I was there more for my kids.  I wish I didn't have to sell my old comic books to pay for this santa suit.  I wish I knew my wife had taken the kids to her mother's.  I wish they were home.  I wish I was 30 pounds lighter.  Most of all, I wish someone could hear me in screaming in this chimney.",,False,,t5_2t6kz,False,,,True,t3_2p4bee,http://www.reddit.com/r/shortscarystories/comments/2p4bee/christmas_contestchristmas_wishes/,
1418077971.0,21,self.shortscarystories,2ooxc2,Christmas Contest!,Mx-yz-pt-lk,21,0,20,http://www.reddit.com/r/shortscarystories/comments/2ooxc2/christmas_contest/,"Rules:


1) All SSS rules must be followed


2) The story has to involve Christmas in some way. 


3) [Christmas Contest] needs to be in the title. If it's not then we won't see your post when we search for the top ten. 


Contest ends Christmas Day. The winner will be picked by the mods from the ten most upvoted stories and  will receive custom flair, have their story narrated on chillingtalesfordarknights.com, and will be January's writer of the month! 


Edit: Thank you /u/The_Demon_Barber for reminding me that the winner will also receive a picture of a super crazy adorable baby animal. ",,False,,t5_2t6kz,1418183601.0,,,True,t3_2ooxc2,http://www.reddit.com/r/shortscarystories/comments/2ooxc2/christmas_contest/,moderator
1418406211.0,31,self.shortscarystories,2p3gnv,The Lotion,krshann,31,0,10,http://www.reddit.com/r/shortscarystories/comments/2p3gnv/the_lotion/,"I had seen all the unbelievable commercials. Seen all of the belts, pills, elliptical/treadmill hybrids the mind could possibly invent. Eating my feelings, not exercising...it's a quick slide to the bottom of the physical fitness scale. But of course, like I said, I knew better than to trust those commercials. 

The lotion was a gift.

My husband had bought it for me. A nice surprise, really, since I felt our marriage had been slowing down the past few years. His unwillingness to maintain physical contact, his averted gaze whenever we spoke... Richard had always been a nice guy but suddenly he'd changed, becoming a person I didn't know. He wasn't attracted to me, wanted a divorce. I wanted to work it out.

But the lotion was a peace offering. 

""It's a gift, from a medicine woman,"" he said, giving me a small smile. ""She uses it to help those who want to lose weight but conventional methods seem to not work."" I kissed him gently, thanking him for the gift. I was happy he was making an effort again.

That night, after I got out of the tub, I rubbed the lotion on my body, legs first. Richard had told me that I needed to make sure to rub it in...the heat of the rubbing activates it.

I waited.

Waited.

Burning sensations started. My body was overwhelmingly hot, boiling under the lotion. The skin started to peel and I began to panic. As I stood up to make my way back to the shower to rinse it off, skin began decomposing and sliding off my bones.  I screamed.

 And Richard laughed.
",,False,,t5_2t6kz,1418410052.0,,,True,t3_2p3gnv,http://www.reddit.com/r/shortscarystories/comments/2p3gnv/the_lotion/,
1418394229.0,45,self.shortscarystories,2p2wan,[Christmas Contest] SantaCorp,MikeTheBoomer,45,0,1,http://www.reddit.com/r/shortscarystories/comments/2p2wan/christmas_contest_santacorp/,"This is how Christmas works these days.  You have a child and then wait for what seems like months for a chance to meet Santa Claus.  If we had any choice, we wouldn't have queued in the snow and freezing temperatures for hours to see him.  The truth is we can't afford not to.

Finally, my wife, Ria, and I are next in line.  An elf with a clipboard takes our details and then begins running through a prepared script.

""You understand that in donating you first born child to SantaCorp, any and all children you have in the future will be provided with free gifts at Christmastime?""
 
""Yes."" I answer.

""You understand that once you enter Santa's grotto you cannot back out of the deal and the process must be completed?""

""Yes.""

""You understand that if either of you close your eyes or look away during the procedure the agreement will be void and SantaCorp will not acknowledge your donation?""

""Yes.""

""Okay.  Step through the double doors when you're ready.  He will see you now.""

Ria grabs my hand tightly as she holds our child to her chest.  I can see her eyes filling with tears as we step through the double doors.

The sight of him makes me gag.  His suit may once have been well-fitting, but his large, hairy stomach has ripped through it and rests on his lap.  His long grey hair and beard haven't been washed for some time; they are tangled and matted with blood.

I can't decide what's worse about this situation; the fact that he will devour our only child or that we have to watch.",,False,,t5_2t6kz,False,,,True,t3_2p2wan,http://www.reddit.com/r/shortscarystories/comments/2p2wan/christmas_contest_santacorp/,
1418402583.0,19,self.shortscarystories,2p3a29,Rush Hour,AwilsonLondon,19,0,1,http://www.reddit.com/r/shortscarystories/comments/2p3a29/rush_hour/,"The train came into the tunnel, as crowds flooded the platform and bottle-necked the doors, Jon realized he was going to miss this train too. He was too unassertive to battle the more aggressive commuters who were more than happy to push him out of the way. The train took off and the wind misplaced his ever so carefully combed hair, he swore to himself that he would make the next train. It was only now the train passed that he paid attention to the adverts on the back wall. Most of them were trying too sell you on the idea of parting with your cash. Among these was a travel advertisement, the tagline read,
 ""What Are You Waiting For?"",
The clock read, next train 1 minute, he loosened his color from his throat as the next train emerged at the end of the tunnel. Jon thought to himself it's time to go. He placed his hands faintly on the back of the person just in front, then fixed his feet firm to the floor, before whispering into their ear,
 ""I can push too""..... ",,False,,t5_2t6kz,False,,,True,t3_2p3a29,http://www.reddit.com/r/shortscarystories/comments/2p3a29/rush_hour/,
1418352344.0,206,self.shortscarystories,2p1gia,Six Little Children [Christmas Contest],IPostAtMidnight,206,0,16,http://www.reddit.com/r/shortscarystories/comments/2p1gia/six_little_children_christmas_contest/,"Father clapped his hands loudly to silence the noisy house.

""Now then,"" he said, ""are all you children ready for bed? Before you scamper off to dream of stockings and sugar-plums, Grandmother will tell you a story.""

The old woman hummed to herself while they gathered on the floor around her rocking chair. Once they grew quiet again, she spoke over the soft crackling of the fireplace. ""When I was a girl, there was a tradition of telling scary ghost stories on Christmas Eve. But not this year. This year, I'm going to tell you the truth. Would you like that?""

Sleepy heads nodded. Grandmother cleared her throat and began to recite a poem.

&amp;nbsp;

""Six little children, all in a row.    
Which one will be dragged out into the snow?    
Santa brings gifts but he takes a gift too,    
Each year a young tribute, as is his due.    
He works them to death making next year's toys,    
Those we call elves, who were once girls and boys.    
But Santa weaves magic and once morning dawns,    
Good children forget the bad one who's gone.    
So which of you six was the naughtiest tot?    
Can't hide from Santa, you're sure to be--""

&amp;nbsp;

""But Grandma!"" the smallest girl interrupted, then covered her mouth.

""Yes, dear?""

In a tiny voice, almost a whisper, the girl continued.

""There are only five of us.""

Grandmother leaned forward, raised her spectacles, and slowly counted the children around her chair. When her finger reached an empty spot, she stopped.

""My goodness, so there are. I'm getting forgetful, too.""

Then she leaned back and began again.

""Five little children, all in a row...""",,False,,t5_2t6kz,False,,,True,t3_2p1gia,http://www.reddit.com/r/shortscarystories/comments/2p1gia/six_little_children_christmas_contest/,
1418421481.0,4,self.shortscarystories,2p490a,Higher Power,crimsonire92,4,0,1,http://www.reddit.com/r/shortscarystories/comments/2p490a/higher_power/,"Even with wings outstretched, the look of it was anything but holy. Its body torn asunder, pure energy pouring out from within holes gouged deep into its flesh; a strange malevolence emanated from it.

Within its chamber, black wisps of cold technology extended outward from a base beneath the thing, waves of the same terrible energy coursing through. Its crimson eyes stared onward, beyond me; a feeling that it could somehow see through me, into the deepest recesses of my soul inhabited me whenever I looked upon it.

I knew better though; it had been years since we had discovered them, and countless studies until we fully understood them.

Understood their value.

I turned back to my monitor, London was experiencing a brown out in the third quarter and a red bar flashed consistently across my screen. With a swiping motion I cleared the alert, activating backup generators to pull in the extra energy needed. 

Sweeping black tendrils instantly coalesced, pushing themselves deep into several of the glowing holes in the things form. It stood steady, unmoved and seemingly unfazed; the potent energy flowing outward through the cables to London.

The thing about Angels, is they don't feel pain. They don't seem to feel anything, in fact; which is why they are so perfectly used in this capacity. 

But those eyes, they are always staring. Its unnerving, how they almost seem to be watching for something; waiting.

Those words are on the screen again, the ones I try to ignore; the red ones. They're different this time though, something that chills me to the bone:

*The Chariots are coming...*",,False,,t5_2t6kz,False,,,True,t3_2p490a,http://www.reddit.com/r/shortscarystories/comments/2p490a/higher_power/,
